{
  "$schema": "./welcome-screens.schema.json",
  "catalogVersion": 1,
  "project": {
    "name": "Top Welcome Screens for SwiftUI",
    "platform": "iOS",
    "uiFramework": "SwiftUI",
    "minimumDeploymentTarget": "16.4",
    "referenceCanvas": {
      "width": 640,
      "height": 1385
    },
    "screenCount": 10,
    "semanticActionCount": 33,
    "motionSpecPath": "docs/MOTION_SPEC.md",
    "integrationGuidePath": "docs/SWIFTUI_IMPLEMENTATION_GUIDE.md",
    "legalNoticePath": "NOTICE.md",
    "assetProvenancePath": "docs/ASSET_PROVENANCE.md"
  },
  "sharedFiles": [
    {
      "path": "WelcomeScreenGallery/Shared/ReferenceGeometry.swift",
      "role": "Defines the 640×1385 reference coordinate system and absolute placement helpers.",
      "requiredWhen": "always"
    },
    {
      "path": "WelcomeScreenGallery/Shared/ReferenceCanvas.swift",
      "role": "Uniformly scales, centers, and clips the reference canvas for the host display.",
      "requiredWhen": "always"
    },
    {
      "path": "WelcomeScreenGallery/Shared/ReplicaAssets.swift",
      "role": "Resolves bundled replica images and fixed Inter or Nunito font aliases.",
      "requiredWhen": "always"
    },
    {
      "path": "WelcomeScreenGallery/Shared/ReplicaControls.swift",
      "role": "Provides interaction-gated controls, icons, shared shapes, and color helpers.",
      "requiredWhen": "always"
    },
    {
      "path": "WelcomeScreenGallery/Shared/MotionTimeline.swift",
      "role": "Supplies deterministic elapsed milliseconds, easing helpers, replay, and Reduce Motion behavior.",
      "requiredWhen": "animated"
    },
    {
      "path": "WelcomeScreenGallery/Domain/WelcomeAction.swift",
      "role": "Defines typed semantic actions and host callback resolution.",
      "requiredWhen": "recommended"
    },
    {
      "path": "WelcomeScreenGallery/Domain/WelcomeScreenID.swift",
      "role": "Registers gallery IDs, display names, and motion durations.",
      "requiredWhen": "gallery-only"
    },
    {
      "path": "WelcomeScreenGallery/Features/WelcomeScreen.swift",
      "role": "Switches between all registered gallery studies.",
      "requiredWhen": "gallery-only"
    }
  ],
  "screens": [
    {
      "id": "duolingo",
      "displayName": "Duolingo",
      "swiftUIView": "DuolingoWelcome",
      "sourcePath": "WelcomeScreenGallery/Features/Screens/DuolingoWelcome.swift",
      "categories": ["splash", "welcome"],
      "animated": true,
      "durationMilliseconds": 2667,
      "assets": [
        "assets/welcome/duolingo/mascot-closed.png",
        "assets/welcome/duolingo/mascot.png",
        "assets/welcome/duolingo/splash-face-closed.png",
        "assets/welcome/duolingo/splash-face.png",
        "assets/welcome/duolingo/wordmark.png"
      ],
      "fontFiles": [
        "WelcomeScreenGallery/Resources/Fonts/Nunito_400Regular.ttf",
        "WelcomeScreenGallery/Resources/Fonts/Nunito_900Black.ttf"
      ],
      "actions": [
        { "id": "duolingo.get-started", "label": "Get started", "availableFromMilliseconds": 1233 },
        { "id": "duolingo.log-in", "label": "Log in", "availableFromMilliseconds": 1233 }
      ],
      "motion": [
        { "startMilliseconds": 400, "endMilliseconds": 567, "effect": "blink", "description": "First owl blink." },
        { "startMilliseconds": 900, "endMilliseconds": 1033, "effect": "scale-out", "description": "Centered splash face accelerates down in scale." },
        { "startMilliseconds": 1133, "endMilliseconds": 1233, "effect": "circular-mask-reveal", "description": "Completed page expands through a circular mask." },
        { "startMilliseconds": 2467, "endMilliseconds": 2600, "effect": "blink", "description": "Final mascot blink." }
      ],
      "notes": "Preserve both blink phases and the circular reveal; controls become interactive when the reveal completes."
    },
    {
      "id": "strava",
      "displayName": "Strava",
      "swiftUIView": "StravaWelcome",
      "sourcePath": "WelcomeScreenGallery/Features/Screens/StravaWelcome.swift",
      "categories": ["splash", "loading", "welcome"],
      "animated": true,
      "durationMilliseconds": 6600,
      "assets": [
        "assets/welcome/strava/hero.png",
        "assets/welcome/strava/wordmark.png"
      ],
      "fontFiles": [
        "WelcomeScreenGallery/Resources/Fonts/Inter_400Regular.ttf",
        "WelcomeScreenGallery/Resources/Fonts/Inter_600SemiBold.ttf"
      ],
      "actions": [
        { "id": "strava.join-for-free", "label": "Join for free", "availableFromMilliseconds": 5133 },
        { "id": "strava.log-in", "label": "Log in", "availableFromMilliseconds": 5133 }
      ],
      "motion": [
        { "startMilliseconds": 0, "endMilliseconds": 833, "effect": "static-splash", "description": "Static orange logo splash." },
        { "startMilliseconds": 867, "endMilliseconds": 5133, "effect": "spinner", "description": "Activity spinner rotates below the logo." },
        { "startMilliseconds": 5133, "effect": "hard-cut", "description": "Hard cut to the completed page." }
      ],
      "notes": "The transition at 5.133 seconds is a hard cut, not a crossfade."
    },
    {
      "id": "myfitnesspal",
      "displayName": "MyFitnessPal",
      "swiftUIView": "MyFitnessPalWelcome",
      "sourcePath": "WelcomeScreenGallery/Features/Screens/MyFitnessPalWelcome.swift",
      "categories": ["loading", "welcome", "onboarding"],
      "animated": true,
      "durationMilliseconds": 8867,
      "assets": [
        "assets/welcome/myfitnesspal/card.png",
        "assets/welcome/myfitnesspal/next-card.png",
        "assets/welcome/myfitnesspal/wordmark.png"
      ],
      "fontFiles": [
        "WelcomeScreenGallery/Resources/Fonts/Inter_400Regular.ttf",
        "WelcomeScreenGallery/Resources/Fonts/Inter_600SemiBold.ttf",
        "WelcomeScreenGallery/Resources/Fonts/Inter_700Bold.ttf"
      ],
      "actions": [
        { "id": "myfitnesspal.sign-up-for-free", "label": "Sign up for free", "availableFromMilliseconds": 7333 },
        { "id": "myfitnesspal.log-in", "label": "Log in", "availableFromMilliseconds": 7333 }
      ],
      "motion": [
        { "startMilliseconds": 0, "endMilliseconds": 2900, "effect": "loading-copy", "description": "Blue loader reads Updating...." },
        { "startMilliseconds": 2900, "effect": "hard-copy-switch", "description": "Loader copy switches to Loading... without a dissolve." },
        { "startMilliseconds": 7333, "effect": "hard-cut", "description": "Hard cut to the completed carousel page." }
      ],
      "notes": "Keep the copy change and final page transition as hard switches."
    },
    {
      "id": "perplexity",
      "displayName": "Perplexity",
      "swiftUIView": "PerplexityWelcome",
      "sourcePath": "WelcomeScreenGallery/Features/Screens/PerplexityWelcome.swift",
      "categories": ["welcome", "authentication"],
      "animated": false,
      "durationMilliseconds": null,
      "assets": [
        "assets/welcome/perplexity/brand-lockup.png"
      ],
      "fontFiles": [
        "WelcomeScreenGallery/Resources/Fonts/Inter_400Regular.ttf",
        "WelcomeScreenGallery/Resources/Fonts/Inter_500Medium.ttf"
      ],
      "actions": [
        { "id": "perplexity.close", "label": "Close", "availableFromMilliseconds": 0 },
        { "id": "perplexity.continue-with-apple", "label": "Continue with Apple", "availableFromMilliseconds": 0 },
        { "id": "perplexity.continue-with-google", "label": "Continue with Google", "availableFromMilliseconds": 0 },
        { "id": "perplexity.sign-in-with-email", "label": "Sign in with email", "availableFromMilliseconds": 0 },
        { "id": "perplexity.single-sign-on", "label": "Single sign-on", "availableFromMilliseconds": 0 },
        { "id": "perplexity.privacy-policy", "label": "Privacy policy", "availableFromMilliseconds": 0 },
        { "id": "perplexity.terms-of-service", "label": "Terms of service", "availableFromMilliseconds": 0 }
      ],
      "motion": [],
      "notes": "Still-only by design because the research set contains no motion reference. Do not invent an entrance animation."
    },
    {
      "id": "yazio",
      "displayName": "Yazio",
      "swiftUIView": "YazioWelcome",
      "sourcePath": "WelcomeScreenGallery/Features/Screens/YazioWelcome.swift",
      "categories": ["splash", "welcome", "onboarding"],
      "animated": true,
      "durationMilliseconds": 1733,
      "assets": [
        "assets/welcome/yazio/apples.png",
        "assets/welcome/yazio/calendar.png",
        "assets/welcome/yazio/carrot.png",
        "assets/welcome/yazio/chef-hat.png",
        "assets/welcome/yazio/clock.png",
        "assets/welcome/yazio/intro-mascot.png",
        "assets/welcome/yazio/wordmark.png"
      ],
      "fontFiles": [
        "WelcomeScreenGallery/Resources/Fonts/Nunito_800ExtraBold.ttf",
        "WelcomeScreenGallery/Resources/Fonts/Nunito_900Black.ttf"
      ],
      "actions": [
        { "id": "yazio.get-started", "label": "Get started", "availableFromMilliseconds": 1733 },
        { "id": "yazio.log-in", "label": "Log in", "availableFromMilliseconds": 1733 }
      ],
      "motion": [
        { "startMilliseconds": 567, "endMilliseconds": 800, "effect": "cross-dissolve", "description": "Splash dissolves into the destination shell." },
        { "startMilliseconds": 1167, "endMilliseconds": 1733, "effect": "staggered-springs", "description": "Food and utility illustrations enter as separately staggered damped springs." }
      ],
      "notes": "Preserve the independent spring timing for carrot, apples, clock, calendar, and chef hat."
    },
    {
      "id": "onx-hunt",
      "displayName": "onX Hunt",
      "swiftUIView": "OnxHuntWelcome",
      "sourcePath": "WelcomeScreenGallery/Features/Screens/OnxHuntWelcome.swift",
      "categories": ["splash", "authentication"],
      "animated": true,
      "durationMilliseconds": 1467,
      "assets": [